link,title,enroll_count,provider,num_ratings,description
https://www.coursera.org/specializations/natural-language-processing,Natural Language Processing,86018,DeepLearning.AI,4504,"Natural Language Processing (NLP) is a subfield of linguistics, computer science, and artificial intelligence that uses algorithms to interpret and manipulate human language.

This technology is one of the most broadly applied areas of machine learning and is critical in effectively analyzing massive quantities of unstructured, text-heavy data. As AI continues to expand, so will the demand for professionals skilled at building models that analyze speech and language, uncover contextual patterns, and produce insights from text and audio.

By the end of this Specialization, you will be ready to design NLP applications that perform question-answering and sentiment analysis, create tools to translate languages and summarize text, and even build chatbots. These and other NLP applications are going to be at the forefront of the coming transformation to an AI-powered future.

This Specialization is designed and taught by two experts in NLP, machine learning, and deep learning. Younes Bensouda Mourri is an Instructor of AI at Stanford University who also helped build the Deep Learning Specialization. Łukasz Kaiser is a Staff Research Scientist at Google Brain and the co-author of Tensorflow, the Tensor2Tensor and Trax libraries, and the Transformer paper."
https://www.coursera.org/specializations/java-programming,Java Programming and Software Engineering Fundamentals,272994,Duke University,13518,"Take your first step towards a career in software development with this introduction to Java—one of the most in-demand programming languages and the foundation of the Android operating system. Designed for beginners, this Specialization will teach you core programming concepts and equip you to write programs to solve complex problems. In addition, you will gain the foundational skills a software engineer needs to solve real-world problems, from designing algorithms to testing and debugging your programs."
https://www.coursera.org/learn/c-structured-programming,C for Everyone: Structured Programming,48537,"University of California, Santa Cruz",602,"In the new world we live in, coding is a universally valuable skill, whether you're a scientist, artist, or a humanist. Algorithms are everywhere, and we all have to understand how they work. The C language is particularly well suited as an introduction to coding: It's a tried-and-true language, and it allows you to understand computing processes at a deep level. You will also get an introduction to more advanced programming in C++ in the final module. This is a continuation of C for Everyone: Fundamentals, which you should take before beginning this course. 
The time estimated time commitment for this course is five hours a week for five weeks."
https://www.coursera.org/learn/algorithmic-toolbox,Algorithmic Toolbox,458703,University of California San Diego,12028,"This online course covers basic algorithmic techniques and ideas for computational problems arising frequently in practical applications: sorting and searching, divide and conquer, greedy algorithms, dynamic programming. We will learn a lot of theory: how to sort data and how it helps for searching; how to break a large problem into pieces and solve them recursively; when it makes sense to proceed greedily; how dynamic programming is used in genomic studies. You will practice solving computational problems, designing new algorithms, and implementing solutions efficiently (so that they run in less than a second)."
https://www.coursera.org/specializations/generative-adversarial-networks-gans,Generative Adversarial Networks (GANs),28475,DeepLearning.AI,1810,"About GANsGenerative Adversarial Networks (GANs) are powerful machine learning models capable of generating realistic image, video, and voice outputs.

Rooted in game theory, GANs have wide-spread application: from improving cybersecurity by fighting against adversarial attacks and anonymizing data to preserve privacy to generating state-of-the-art images, colorizing black and white images, increasing image resolution, creating avatars, turning 2D images to 3D, and more.

About this Specialization

The DeepLearning.AI Generative Adversarial Networks (GANs) Specialization provides an exciting introduction to image generation with GANs, charting a path from foundational concepts to advanced techniques through an easy-to-understand approach. It also covers social implications, including bias in ML and the ways to detect it, privacy preservation, and more.

Build a comprehensive knowledge base and gain hands-on experience in GANs. Train your own model using PyTorch, use it to create images, and evaluate a variety of advanced GANs.

About you

This Specialization is for software engineers, students, and researchers from any field, who are interested in machine learning and want to understand how GANs work.

This Specialization provides an accessible pathway for all levels of learners looking to break into the GANs space or apply GANs to their own projects, even without prior familiarity with advanced math and machine learning research."
https://www.coursera.org/learn/computational-thinking-problem-solving,Computational Thinking for Problem Solving,86711,University of Pennsylvania,1211,"Computational thinking is the process of approaching a problem in a systematic manner and creating and expressing a solution such that it can be carried out by a computer.  But you don't need to be a computer scientist to think like a computer scientist!  In fact, we encourage students from any field of study to take this course.  Many quantitative and data-centric problems can be solved using computational thinking and an understanding of computational thinking will give you a foundation for solving problems that have real-world, social impact.   In this course, you will learn about the pillars of computational thinking, how computer scientists develop and analyze algorithms, and how solutions can be realized on a computer using the Python programming language.  By the end of the course, you will be able to develop an algorithm and express it to the computer by writing a simple Python program. 

This course will introduce you to people from diverse professions who use computational thinking to solve problems. You will engage with a unique community of analytical thinkers and be encouraged to consider how you can make a positive social impact through computational thinking."
https://www.coursera.org/learn/algorithms-part1,"Algorithms, Part I",1029181,Princeton University,9997,"This course covers the essential information that every serious programmer needs to know about algorithms and data structures, with emphasis on applications and scientific performance analysis of Java implementations. Part I covers elementary data structures, sorting, and searching algorithms. Part II focuses on graph- and string-processing algorithms.All the features of this course are available for free.  It does not offer a certificate upon completion."
https://www.coursera.org/learn/logic-introduction,Introduction to Logic,190885,Stanford University,610,"This course is an introduction to Logic from a computational perspective. It shows how to encode information in the form of logical sentences; it shows how to reason with information in this form; and it provides an overview of logic technology and its applications - in mathematics, science, engineering, business, law, and so forth."
https://www.coursera.org/learn/matlab-image-processing,"Introduction to Data, Signal, and Image Analysis with MATLAB",21390,Vanderbilt University,161,"Welcome to Introduction to Data, Signal, and Image Analysis with MATLAB!     MATLAB is an extremely versatile programming language for data, signal, and image analysis tasks. This course provides an introduction on how to use MATLAB for data, signal, and image analysis. After completing the course,  learners will understand how machine learning methods can be used in MATLAB for data classification and prediction; how to perform data visualization, including data visualization for high dimensional datasets; how to perform image processing and analysis methods, including image filtering and image segmentation; and how to perform common signal analysis tasks, including filter design and frequency analysis."
https://www.coursera.org/professional-certificates/tensorflow-in-practice,DeepLearning.AI TensorFlow Developer,157864,DeepLearning.AI,19421,"TensorFlow is one of the most in-demand and popular open-source deep learning frameworks available today. The DeepLearning.AI TensorFlow Developer Professional Certificate program teaches you applied machine learning skills with TensorFlow so you can build and train powerful models.

In this hands-on, four-course Professional Certificate program, you’ll learn the necessary tools to build scalable AI-powered applications with TensorFlow. After finishing this program, you’ll be able to apply your new TensorFlow skills to a wide range of problems and projects. This program can help you prepare for the Google TensorFlow Certificate exam and bring you one step closer to achieving the Google TensorFlow Certificate.

Ready to deploy your models to the world? Learn how to go live with your models with the TensorFlow: Data and Deployment Specialization.

Looking to customize and build powerful real-world models for complex scenarios? Check out the TensorFlow: Advanced Techniques Specialization."
https://www.coursera.org/professional-certificates/google-cloud-digital-leader-training,Google Cloud Digital Leader Training,25740,Google Cloud,1524,"The Cloud Digital Leader training consists of a course series designed to give you foundational knowledge about cloud technology and data. This training also offers an overview of Google Cloud products and services that enable organizations’ digital transformation. This training will empower you and your team(s) to contribute to cloud-related business initiatives across your organization.This training builds knowledge in these areas:

General cloud knowledge General Google Cloud knowledge Google Cloud products and services Digital transformation, data, and AI/ML Modernizing company IT infrastructure and applications"
https://www.coursera.org/professional-certificates/aws-cloud-solutions-architect,AWS Cloud Solutions Architect ,0,Amazon Web Services,2990,"This professional certificate provides the knowledge and skills you need to start building your career in cloud architecture and helps you prepare for the AWS Certified Solutions Architect - Associate exam. You will start by learning key AWS Services for compute, storage, database, networking, monitoring, and security, then dive into how to design architectural solutions, how to create and operate a data lake, and how to prepare for the certification exam.The AWS Certified Solutions Architect – Associate certification showcases knowledge and skills in AWS technology across a wide range of AWS services. The certification focuses on the design of cost and performance optimized solutions and demonstrating a strong understanding of the AWS Well-Architected Framework. This AWS Certification is one of the top-paying IT certifications, per the SkillSoft IT Skills and Salary report. Per Enterprise Strategy Group, surveyed AWS Certification holders credited their certification for their higher earnings (74%), increased confidence (87%), and increased influence among coworkers (79%).

To prepare for your AWS Certification exam, we recommend that — in addition to attaining this professional certificate — candidates review the free exam guide, sample questions, and AWS technical documentation (e.g. white papers and product FAQs) on the AWS Certified Solutions Architect - Associate exam page to understand what content and services are covered by the exam."
https://www.coursera.org/professional-certificates/microsoft-azure-dp-203-data-engineering,Microsoft Azure Data Engineering Associate (DP-203),10303,Microsoft,350,"This Professional Certificate is intended for data engineers and developers who want to demonstrate their expertise in designing and implementing data solutions that use Microsoft Azure data services anyone interested in preparing for the Exam DP-203: Data Engineering on Microsoft Azure. This Professional Certificate will help you develop expertise in designing and implementing data solutions that use Microsoft Azure data services. You will learn how to integrate, transform, and consolidate data from various structured and unstructured data systems into structures that are suitable for building analytics solutions that use Microsoft Azure data services. This program consists of 10 courses to help prepare you to take Exam DP-203: Data Engineering on Microsoft Azure. Each course teaches you the concepts and skills that are measured by the exam. By the end of this Professional Certificate, you will be ready to take and sign-up for the Exam DP-203: Data Engineering on Microsoft Azure."
https://www.coursera.org/learn/cloud-practitioner-exam-prep,Exam Prep: AWS Certified Cloud Practitioner Foundations,4699,Amazon Web Services,28,"This new foundational-level course from Amazon Web Services (AWS), is designed to help you to assess your preparedness for the AWS Certified Cloud Practitioner certification exam.  You will learn how to prepare for the exam by exploring the exam’s topic areas and how they map to both AWS Cloud practitioner roles and to specific areas of study. You will review sample certification questions in each domain, practice skills with hands-on exercises, test your knowledge with practice question sets, and learn strategies for identifying incorrect responses by interpreting the concepts that are being tested in the exam. At the end of this course you will have all the knowledge and tools to help you identity your strengths and weaknesses in each certification domain areas that are being tested on the certification exam. The AWS Certified Cloud Foundations Certification the AWS Certified Cloud Practitioner (CLF-C01) exam is intended for individuals who can effectively demonstrate an overall knowledge of the AWS Cloud independent of a specific job role. The exam validates a candidate’s ability to complete the following tasks: Explain the value of the AWS Cloud, Understand and explain the AWS shared responsibility model, understand security best practices, Understand AWS Cloud costs, economics, and billing practices, Describe and position the core AWS services, including compute, network, databases, and storage and identify AWS services for common use cases"
https://www.coursera.org/learn/oraclecloud-infrastructure-foundations,Oracle Cloud Infrastructure Foundations,10757,Oracle,132,"Welcome to the course OCI Foundations Course. This course is a starting point to prepare you for the Oracle Cloud Infrastructure Foundations Associate Certification. Begin with an introduction of the OCI platform, and then dive into the core primitives, compute, storage, networking, identity, databases, security, and more."
https://www.coursera.org/professional-certificates/google-it-support,Google IT Support,1105233,Google,146123,"Prepare for a career in the high-growth field of IT, no experience or degree required. Get professional training designed by Google and get on the fast-track to a competitively paid job. There are 400,000 U.S. job openings in IT and a $52,000 median entry-level salary in IT support.¹Over 5 courses, learn in-demand skills that prepare you for an entry-level job. Upon completion, you can directly apply for jobs with Google and over 150 U.S. employers, including Walmart, Best Buy, and Astreya.

75% of Google Career Certificate Graduates in the United States report an improvement in their career trajectory (e.g. new job or career, promotion or raise) within 6 months of certificate completion²

This program also prepares you for the CompTIA A+ exams, the industry standard certification for IT—you’ll earn a dual credential when you complete both.

This program is ACE® approved—when you complete, you can earn up to 12 college credits, the equivalent of 4 associate degree-level courses.

If you’re interested in building on your IT foundations, check out the Google IT Automation with Python Professional Certificate.

Check out all Google Career Certificates here.

¹US Burning Glass Labor Insight Report salary data (median with 0-5 years experience) and job opening data. Data for job roles relevant to featured programs (4/01/2021 - 3/31/22).

²Based on program graduate survey responses, United States 2021"
https://www.coursera.org/specializations/microsoft-365-fundamentals,Microsoft 365 Fundamentals,24419,Microsoft,661,"This Specialization is intended to help all novice computer users get up to speed with Microsoft 365 quickly. It covers different features of the interface, shows you how to perform basic tasks, and introduces you to the most important tools in Word, PowerPoint, and Excel. This program will help you to become familiar with the apps and services included in a Microsoft 365 subscription. You will improve your word processing, spreadsheet, and presentation skills to take your productivity to the next level. You will learn how to work smarter and more collaboratively with the latest intelligent features of Office 365. By the end of this program of courses, you will be ready to take and sign-up for the MO-100: Microsoft Word (Word and Word 2019), MO-200: Microsoft Excel (Excel and Excel 2019), and MO-300: Microsoft PowerPoint (PowerPoint and PowerPoint 2019)."
https://www.coursera.org/professional-certificates/sre-devops-engineer-google-cloud,Preparing for Google Cloud Certification: Cloud DevOps Engineer,27448,Google Cloud,2130,"This program provides the skills you need to advance your career as a data engineer and provides training to support your preparation for the industry-recognized Google Cloud Professional DevOps Engineer certification. 87% of Google Cloud certified users feel more confident in their cloud skills.

You'll also have the opportunity to practice key job skills using Google Cloud to build software delivery pipelines, deploy and monitor services, and manage and learn from incidents. You will learn to apply SRE principles to a service, techniques for monitoring, troubleshooting, and improving infrastructure and application performance among other things.

Your journey to Google Cloud certification:

1) Complete the Coursera Site Reliability Engineering and DevOps Professional Certificate

2) Review other recommended learning resources for the Google Cloud Professional Cloud DevOps Engineer certification exam

3) Review the Professional Cloud DevOps Engineer exam guide

4) Take the Professional Cloud DevOps Engineer practice exam

5) Register for the Google Cloud certification exam (Can be taken remotely or at a test center)"
https://www.coursera.org/learn/oracle-cloud-infrastructure-architect-professional,Oracle Cloud Infrastructure Architect Professional,1661,Oracle,10,"Welcome to the course Oracle Cloud Infrastructure Architect Professional. This course prepares you for the highest level of OCI certification, Oracle Cloud Infrastructure Architect Professional. Take a deep dive into designing and deploying Oracle Cloud Infrastructure solutions and learn Cloud-Native, microservices and serverless architectures."
https://www.coursera.org/specializations/it-cloud-fundamentals,Information Technology (IT) and Cloud Fundamentals,3251,IBM Skills Network,145,"In today’s connected world, core knowledge of IT hardware, software, networking, cybersecurity, and cloud technologies is vital for almost every function, or role within an organization. Adding storage, updating an operating system, connecting to a network, recognizing phishing, and setting up Cloud instances are some of the skills employees need or need help with. This five-course specialization provides prerequisite skills for almost all IT careers, including technical support specialist, data analyst, data scientist, AI specialist, web developer, software engineer, systems administrator, DevOps and site reliability engineer, data center technician, networking specialist, IT Manager, and cyber-security analyst.You’ll acquire hardware, operating systems, programming, database, networking, storage, cybersecurity, and cloud computing knowledge and skills that can prepare you for an entry-level IT role or better help you understand and manage IT responsibilities within your organization.

In addition to receiving an IBM credential upon successful completion of this specialization, it provides a dual benefit of preparing you for the CompTIA IT Fundamentals (IFT+) Certification Exam, which can attest to your skills, helping you gain a competitive advantage.

This program is for beginners. To start this program, no prior IT background, programming experience, or cloud skills are required. All that's necessary is basic computer literacy."
https://www.coursera.org/specializations/oracle-sql-databases,Oracle SQL Databases,6068,LearnQuest,242,"This Specialization is intended for beginners to learn how to become proficient writing Oracle SQL code to create, modify, and edit Oracle SQL Databases.You will learn the Oracle database foundations, explore the platform, try your hand at the basics, and become proficient at building and modifying databases."
https://www.coursera.org/professional-certificates/meta-front-end-developer,Meta Front-End Developer,56528,Meta,3280,"Want to get started in the world of coding and build beautiful websites as a career? This 9-course program, designed by the software engineering experts at Meta, will prepare you for a career as a front-end developer.

Once you complete the program, you’ll get access to the Meta Career Programs Job Board—a job search platform that connects you with 200+ employers who have committed to sourcing talent through Meta’s certificate programs, as well as career support resources to help you with your job search.

In this program, you’ll learn:

How to code and build interactive web pages using HTML5, CSS and JavaScript. In-demand design skills to create professional page layouts using industry-standard tools such as Bootstrap, React, and Figma. GitHub repositories for version control, content management system (CMS) and how to edit images using Figma. How to prepare for technical interviews for front-end developer roles.

By the end, you’ll put your new skills to work by completing a real-world project where you’ll create your own front-end web application.

Any third-party trademarks and other intellectual property (including logos and icons) referenced in the learning experience remain the property of their respective owners. Unless specifically identified as such, Coursera’s use of third-party intellectual property does not indicate any relationship, sponsorship, or endorsement between Coursera and the owners of these trademarks or other intellectual property."
https://www.coursera.org/professional-certificates/meta-back-end-developer,Meta Back-End Developer,30896,Meta,1286,"Ready to gain new skills and learn the tools developers use to create websites and web applications? This 10-course program, designed by the software engineering experts at Meta, will prepare you for an entry-level career as a back-end developer.On completion, you’ll get access to the Meta Career Programs Job Board—a job search platform that connects you with 200+ employers who have committed to sourcing talent through Meta’s certificate programs, as well as career support resources to help you with your job search.

In this program, you’ll learn:

Python Syntax—the most popular choice for machine learning, data science and artificial intelligence. In-demand programming skills and how to confidently use code to solve problems. Linux commands and Git repositories to implement version control. The world of data storage and databases using MySQL, and how to craft sophisticated SQL queries. Django web framework and how the front-end consumes data from the REST APIs. How to prepare for technical interviews for back-end developer roles.

Any third-party trademarks and other intellectual property (including logos and icons) referenced in the learning experience remain the property of their respective owners. Unless specifically identified as such, Coursera’s use of third-party intellectual property does not indicate any relationship, sponsorship, or endorsement between Coursera and the owners of these trademarks or other intellectual property."
https://www.coursera.org/learn/python,Programming for Everybody (Getting Started with Python),2702863,University of Michigan,216892,"This course aims to teach everyone the basics of programming computers using Python. We cover the basics of how one constructs a program from a series of simple instructions in Python.  The course has no pre-requisites and avoids all but the simplest mathematics. Anyone with moderate computer experience should be able to master the materials in this course. This course will cover Chapters 1-5 of the textbook “Python for Everybody”.  Once a student completes this course, they will be ready to take more advanced programming courses. This course covers Python 3."
