link,title,enroll_count,provider,num_ratings,description
https://www.coursera.org/learn/duke-programming-web,"Programming Foundations with JavaScript, HTML and CSS",517530,Duke University,14016,"Learn foundational programming concepts (e.g., functions, for loops, conditional statements) and how to solve problems like a programmer. In addition, learn basic web development as you build web pages using HTML, CSS, JavaScript. By the end of the course, will create a web page where others can upload their images and apply image filters that you create.After completing this course, you will be able to:
1. Think critically about how to solve a problem using programming;
2. Write JavaScript programs using functions, for loops, and conditional statements;
3. Use HTML to construct a web page with paragraphs, divs, images, links, and lists;
4. Add styles to a web page with CSS IDs and classes; and
5. Make a web page interactive with JavaScript commands like alert, onClick, onChange, adding input features like an image canvas, button, and slider."
https://www.coursera.org/specializations/data-structures-algorithms,Data Structures and Algorithms,290038,University of California San Diego,12536,"Computer science legend Donald Knuth once said “I don’t understand things unless I try to program them.” We also believe that the best way to learn an algorithm is to program it. However, many excellent books and online courses on algorithms, that excel in introducing algorithmic ideas, have not yet succeeded in teaching you how to implement algorithms, the crucial computer science skill that you have to master at your next job interview. We tried to fill this gap by forming a diverse team of instructors that includes world-leading experts in theoretical and applied algorithms at UCSD (Daniel Kane, Alexander Kulikov, and Pavel Pevzner) and a former software engineer at Google (Neil Rhodes). This unique combination of skills makes this Specialization different from other excellent MOOCs on algorithms that are all developed by theoretical computer scientists. While these MOOCs focus on theory, our Specialization is a mix of algorithmic theory/practice/applications with software engineering. You will learn algorithms by implementing nearly 100 coding problems in a programming language of your choice. To the best of knowledge, no other online course in Algorithms comes close to offering you a wealth of programming challenges (and puzzles!) that you may face at your next job interview. We invested over 3000 hours into designing our challenges as an alternative to multiple choice questions that you usually find in MOOCs."
https://www.coursera.org/learn/python-basics,Python Basics,339519,University of Michigan,15873,"This course introduces the basics of Python 3, including conditional execution and iteration as control structures, and strings and lists as data structures. You'll program an on-screen Turtle to draw pretty pictures. You'll also learn to draw reference diagrams as a way to reason about program executions, which will help to build up your debugging skills. The course has no prerequisites. It will cover Chapters 1-9 of the textbook ""Fundamentals of Python Programming,"" which is the accompanying text (optional and free) for this course.The course is for you if you're a newcomer to Python programming, if you need a refresher on Python basics, or if you may have had some exposure to Python programming but want a more in-depth exposition and vocabulary for describing and reasoning about programs.

This is the first of five courses in the Python 3 Programming Specialization."
https://www.coursera.org/professional-certificates/devops-and-software-engineering,IBM DevOps and Software Engineering,16099,IBM Skills Network,1112,"DevOps professionals are in high demand! According to a recent GitLab report, DevOps skills are expected to grow 122% over the next five years, making it one of the fastest growing skills in the workforce.

This certificate will equip you with the key concepts and technical know-how to build your skills and knowledge of DevOps practices, tools and technologies and prepare you for an entry-level role in Software Engineering.

The courses in this program will help you develop skill sets in a variety of DevOps philosophies and methodologies including Agile Development, Scrum Methodology, Cloud Native Architecture, Behavior and Test-Driven Development, and Zero Downtime Deployments.

You will learn to program with the Python language and Linux shell scripts, create projects in GitHub, containerize and orchestrate your applications using Docker, Kubernetes & OpenShift, compose applications with microservices, employ serverless technologies, perform continuous integration and delivery (CI/CD), develop testcases, ensure your code is secure, and monitor & troubleshoot your cloud deployments.

Guided by experts at IBM, you will be prepared for success. Labs and projects in this certificate program are designed to equip job-ready hands-on skills that will help you launch a new career in a highly in-demand field.

This professional certificate is suitable for both - those who have none or some programming experience, as well as those with and without college degrees."
https://www.coursera.org/learn/object-oriented-java,Object Oriented Programming in Java,264537,University of California San Diego,5502,"Welcome to our course on Object Oriented Programming in Java using data visualization. People come to this course with many different goals -- and we are really excited to work with all of you! Some of you want to be professional software developers, others want to improve your programming skills to implement that cool personal project that you’ve been thinking about, while others of you might not yet know why you’re here and are trying to figure out what this course is all about.This is an intermediate Java course. We recommend this course to learners who have previous experience in software development or a background in computer science.  Our goal is that by the end of this course each and every one of you feels empowered to create a Java program that’s more advanced than any you have created in the past and that is personally interesting to you. In achieving this goal you will also learn the fundamentals of Object Oriented Programming, how to leverage the power of existing libraries, how to build graphical user interfaces, and how to use some core algorithms for searching and sorting data. And this course is project-based, so we’ll dive right into the project immediately!

We are excited to be offering a unique course structure, designed to support learners of different backgrounds in succeeding at their own pace. The first module explains how this will work and if this course is right for you. We also recommend taking a few minutes to explore the course site. A good place to start is the navigation bar on the left. Click Course Content to see what material we’ll cover each week, as well preview the assignments you’ll need to complete to pass the course. Click Discussions to see forums where you can discuss the course material with fellow students taking the class. Be sure to introduce yourself to everyone in the Meet and Greet forum.

This course should take about 6 weeks to complete. You can check out the recommended course schedule below to see a quick overview of the lessons and assignments you’ll complete each week.

We’re excited you’re here learning with us. Let’s get started!"
https://www.coursera.org/specializations/computer-fundamentals,Fundamentals of Computing,55608,Rice University,2841,"This Specialization covers much of the material that first-year Computer Science students take at Rice University, brought to you by the world-class Faculty who teach our master's and PhD programs. Students learn sophisticated programming skills in Python from the ground up and apply these skills in building more than 20 fun projects. The Specialization concludes with a Capstone exam that allows the students to demonstrate the range of knowledge that they have acquired in the Specialization."
https://www.coursera.org/learn/algorithmic-toolbox,Algorithmic Toolbox,458703,University of California San Diego,12028,"This online course covers basic algorithmic techniques and ideas for computational problems arising frequently in practical applications: sorting and searching, divide and conquer, greedy algorithms, dynamic programming. We will learn a lot of theory: how to sort data and how it helps for searching; how to break a large problem into pieces and solve them recursively; when it makes sense to proceed greedily; how dynamic programming is used in genomic studies. You will practice solving computational problems, designing new algorithms, and implementing solutions efficiently (so that they run in less than a second)."
https://www.coursera.org/learn/cs-tech-interview,Mastering the Software Engineering Interview,67099,University of California San Diego,547,"You’ve hit a major milestone as a computer scientist and are becoming a capable programmer. You now know how to solve problems, write algorithms, and analyze solutions; and you have a wealth of tools (like data structures) at your disposal.  You may now be ready for an internship or (possibly) an entry-level software engineering job.  But can you land the internship/job?  It depends in part on how well you can solve new technical problems and communicate during interviews.  How can you get better at this?  Practice!  With the support of Google’s recruiting and engineering teams we’ve provided tips, examples, and practice opportunities in this course that may help you with a number of tech companies.  We’ll assist you to organize into teams to practice.  Lastly, we’ll give you basic job search advice, and tips for succeeding once you’re on the job."
https://www.coursera.org/specializations/software-design-architecture,Software Design and Architecture,53743,University of Alberta,2355,"In the Software Design and Architecture Specialization, you will learn how to apply design principles, patterns, and architectures to create reusable and flexible software applications and systems. You will learn how to express and document the design and architecture of a software system using a visual notation.

Practical examples and opportunities to apply your knowledge will help you develop employable skills and relevant expertise in the software industry."
