link,title,enroll_count,provider,num_ratings,description
https://www.coursera.org/learn/keamanan-it-pertahanan-terhadap-kejahatan-digital,Keamanan IT: Pertahanan terhadap Kejahatan Digital,6763,Google,539,"Pelatihan ini membahas berbagai macam konsep, alat, dan praktik terbaik dari keamanan IT. Di sini akan diperkenalkan ancaman dan serangan dan berbagai cara kemunculan mereka. Kami akan memberi Anda beberapa latar belakang algoritma enkripsi dan bagaimana mereka digunakan untuk melindungi data. Kemudian, kami akan membahas lebih jauh tentang “tiga A”dari keamanan informasi: authentication, authorization, accounting. Kami juga akan membahas solusi keamanan jaringan, mulai dari firewall hingga opsi enkripsi Wifi. Pelatihan ini diakhiri dengan menyatukan semua elemen ini ke dalam arsitektur keamanan yang berlapis-lapis dan mendalam, diikuti dengan rekomendasi tentang cara mengintegrasikan budaya keamanan ke dalam organisasi atau tim Anda.Di akhir pelatihan ini, Anda akan memahami:
● bagaimana cara kerja berbagai algoritma dan teknik enkripsi beserta semua manfaat dan keterbatasannya.
● berbagai sistem dan jenis autentikasi.
● perbedaan antara autentikasi dan otorisasi.
● bagaimana mengevaluasi potensi risiko dan merekomendasikan cara untuk mengurangi risiko.
● praktik baik untuk mengamankan jaringan.
● bagaimana membantu orang lain untuk memahami konsep keamanan dan melindungi diri mereka sendiri."
https://www.coursera.org/learn/pbc1,用 Python 做商管程式設計（一）(Programming for Business Computing in Python (1)),32535,National Taiwan University,745,本系列課程從零開始，教授一般認為最適合初學者的程式語言「Python」，目標是讓大家在完成本課程之後，一方面獲得程式設計與運算思維的基本概念，一方面也能獨立寫出能解決運算問題的程式。本課程和一般程式設計課程最不同的地方，在於它是以解決商管領域的運算問題為導向，因此課程不會只含有質因數分解、紅球白球排列組合、三角不等式、萬年曆、數字排序等傳統程式設計課程的範例與作業，而是包含了生產、物流、存貨、投資、定價等問題，讓大家在學會程式設計的同時，也直接體會程式設計與資訊技術在商管領域的各種應用。本系列課程共分為三門課程。本門課程做為第一門課程，將介紹程式設計的基本觀念、Python 語言的基本語法、選擇、迴圈、清單，並以作業管理領域的一些簡單演算法作結。
https://www.coursera.org/learn/programming-languages-part-b,"Programming Languages, Part B",47306,University of Washington,700,"[As described below, this is Part B of a 3-part course.  Participants should complete Part A first -- Part B ""dives right in"" and refers often to material from Part A.]This course is an introduction to the basic concepts of programming languages, with a strong emphasis on functional programming. The course uses the languages ML, Racket, and Ruby as vehicles for teaching the concepts, but the real intent is to teach enough about how any language “fits together” to make you more effective programming in any language -- and in learning new ones.

This course is neither particularly theoretical nor just about programming specifics -- it will give you a framework for understanding how to use language constructs effectively and how to design correct and elegant programs. By using different languages, you will learn to think more deeply than in terms of the particular syntax of one language. The emphasis on functional programming is essential for learning how to write robust, reusable, composable, and elegant programs. Indeed, many of the most important ideas in modern languages have their roots in functional programming. Get ready to learn a fresh and beautiful way to look at software and how to have fun building it.

The course assumes some prior experience with programming, as described in more detail in the first module of Part A.  Part B assumes successful completion of Part A.

The course is divided into three Coursera courses: Part A, Part B, and Part C.  As explained in more detail in the first module of Part A, the overall course is a substantial amount of challenging material, so the three-part format provides two intermediate milestones and opportunities for a pause before continuing.  The three parts are designed to be completed in order and set up to motivate you to continue through to the end of Part C.  

Week 1 of Part A has a more detailed list of topics for all three parts of the course, but it is expected that most course participants will not (yet!) know what all these topics mean."
https://www.coursera.org/learn/fundamentos-do-design-da-experiencia-do-usuario-ux,Fundamentos do design da experiência do usuário (UX),12124,Google,702,"Fundamentos de design de experiência do usuário (UX) é o primeiro de uma série de sete cursos para equipar você com as habilidades necessárias para se candidatar a vagas iniciantes em design de experiência do usuário. Os designers de UX têm como foco as interações entre pessoas e produtos como sites, app para dispositivos móveis e objetos físicos. Designers de UX tornam essas interações diárias práticas, agradáveis e acessíveis. A função de designer de UX iniciante pode incluir ter empatia com os usuários, definir dificuldades, apresentar soluções de design, criar wireframes, protótipos e maquetes e testar designs para receber feedback. Seus instrutores serão designers e pesquisadores de UX atuais do Google, e você realizará atividades práticas que simulam situações reais de projeto de UX.

Os alunos que concluírem os sete cursos deste programa de certificação estarão equipados para se candidatar a vagas de designers de UX iniciantes. Nenhuma experiência anterior é necessária.

Ao final deste curso, você será capaz de: 
   - definir a área de UX e explicar por que ela é importante para clientes e empresas;
   - compreender os conceitos básicos de design de UX, como design centrado no usuário, o processo de design, acessibilidade e design voltado à equidade; 
   - identificar os fatores que contribuem para um design com ótima experiência do usuário.
   - revisar as responsabilidades comuns do trabalho de designers de UX iniciantes e das equipes com que trabalham;
   - explorar oportunidades de trabalho e planos de carreira no campo da experiência do usuário;  
   - explicar por que os sprints de design são uma parte importante e útil do trabalho de designers de UX;
   - começar a criar um portfólio on-line para mostrar seus próximos trabalhos;
   - inscrever-se e participar de comunidades on-line de experiência do usuário."
https://www.coursera.org/learn/nand2tetris2,Build a Modern Computer from First Principles: Nand to Tetris Part II (project-centered course),53594,Hebrew University of Jerusalem,457,"In this project-centered course you will build a modern software hierarchy, designed to enable the translation and execution of object-based, high-level languages on a bare-bone computer hardware platform. In particular, you will implement a virtual machine and a compiler for a simple, Java-like programming language, and you will develop a basic operating system that closes gaps between the high-level language and the underlying hardware platform. In the process, you will gain a deep, hands-on understanding of numerous topics in applied computer science, e.g. stack processing, parsing, code generation, and classical algorithms and data structures for memory management, vector graphics, input-output handling, and various other topics that lie at the very core of every modern computer system.This is a self-contained course: all the knowledge necessary to succeed in the course and build the various systems will be given as part of the learning experience. The only prerequisite is knowledge of programming at the level acquired in introduction to computer science courses. All the software tools and materials that are necessary to complete the course will be supplied freely after you enrol in the course.

This course is accompanied by the textbook ""The Elements of Computing Systems"" (Nisan and Schocken, MIT Press). While not required for taking the course, the book provides a convenient coverage of all the course topics. The book is available in either hardcopy or ebook form, and MIT Press is offering a 30% discount off the cover price by using the discount code MNTT30 at https://mitpress.mit.edu/books/elements-computing-systems. 

The course consists of six modules, each comprising a series of video lectures, and a project. You will need about 2-3 hours to watch each module's lectures, and about 15 hours to complete each one of the six projects. The course can be completed in six weeks, but you are welcome to take it at your own pace. You can watch a TED talk about this course by Googling ""nand2tetris TED talk"". 

*About Project-Centered Courses: Project-centered courses are designed to help you complete a personally meaningful real-world project, with your instructor and a community of learners with similar goals providing guidance and suggestions along the way. By actively applying new concepts as you learn, you’ll master the course content more efficiently; you’ll also get a head start on using the skills you gain to make positive changes in your life and career. When you complete the course, you’ll have a finished project that you’ll be proud to use and share."
https://www.coursera.org/learn/seguranca-de-it,Segurança de TI: Defesa Contra as Artes Obscuras do Mundo Digital,4921,Google,425,"Este curso aborda uma série de conceitos, ferramentas e práticas recomendadas de segurança de TI. Nele, temos uma introdução às ameaças e ataques e suas muitas formas de se manifestar. Daremos a você uma base de conhecimento sobre algoritmos de criptografia e como eles são usados para proteger dados. Depois, vamos estudar a fundo os três tipos de segurança da informação: autenticação, autorização e registro. Além disso, vamos abordar soluções de segurança de rede, de firewalls a opções de criptografia Wi-Fi. Por fim, vamos analisar o modelo de segurança do Chrome OS em um estudo de caso. O curso é encerrado com a junção de todos esses elementos em uma arquitetura de segurança detalhada e multicamada, seguida de recomendações sobre como integrar uma cultura de segurança à sua empresa ou equipe.Ao fim deste curso, você entenderá:
● como vários algoritmos e técnicas de criptografia funcionam, além de seus benefícios e limitações.
● vários sistemas e tipos de autenticação.
● a diferença entre autenticação e autorização.
● como avaliar os riscos potenciais e recomendar maneiras de atenuá-los.
● práticas recomendadas para proteger uma rede.
● como ajudar as pessoas a entender os conceitos de segurança e se proteger."
https://www.coursera.org/learn/programming-languages-part-c,"Programming Languages, Part C",32396,University of Washington,413,"[As described below, this is Part C of a 3-part course.  Participants should complete Parts A and B first -- Part C ""dives right in"" and refers often to material from Part A and Part B.]This course is an introduction to the basic concepts of programming languages, with a strong emphasis on functional programming. The course uses the languages ML, Racket, and Ruby as vehicles for teaching the concepts, but the real intent is to teach enough about how any language “fits together” to make you more effective programming in any language -- and in learning new ones.

This course is neither particularly theoretical nor just about programming specifics -- it will give you a framework for understanding how to use language constructs effectively and how to design correct and elegant programs. By using different languages, you will learn to think more deeply than in terms of the particular syntax of one language. The emphasis on functional programming is essential for learning how to write robust, reusable, composable, and elegant programs. Indeed, many of the most important ideas in modern languages have their roots in functional programming. Get ready to learn a fresh and beautiful way to look at software and how to have fun building it.

The course assumes some prior experience with programming, as described in more detail in the first module of Part A.  Part B assumes successful completion of Part A.

The course is divided into three Coursera courses: Part A, Part B, and Part C.  As explained in more detail in the first module of Part A, the overall course is a substantial amount of challenging material, so the three-part format provides two intermediate milestones and opportunities for a pause before continuing.  The three parts are designed to be completed in order and set up to motivate you to continue through to the end of Part C.  

Week 1 of Part A has a more detailed list of topics for all three parts of the course, but it is expected that most course participants will not (yet!) know what all these topics mean."
https://www.coursera.org/learn/essential-cloud-infrastructure-foundation-id,Essential Cloud Infrastructure: Foundation dalam bahasa Indonesia,1912,Google Cloud,366,"Kursus akselerasi sesuai permintaan selama 1 minggu ini memperkenalkan peserta pada infrastruktur dan layanan platform yang komprehensif dan fleksibel yang disediakan oleh Google Cloud Platform. Melalui kombinasi presentasi video, demo, dan uji coba lab langsung, peserta akan mempelajari dan men-deploy berbagai elemen solusi, termasuk komponen infrastruktur seperti jaringan, mesin virtual, dan layanan aplikasi. Anda akan mempelajari cara menggunakan Google Cloud Platform melalui Console dan Cloud Shell. Anda juga akan mempelajari peran arsitek cloud, pendekatan desain infrastruktur, dan konfigurasi networking virtual dengan Virtual Private Cloud (VPC), Project, Jaringan, Subnetwork, alamat IP, Rute, dan Aturan firewall.Prasyarat
 Untuk mendapatkan manfaat optimal dari kursus ini, peserta diharapkan telah:
 • Menyelesaikan kursus Konsep Dasar Google Cloud Platform (Infrastruktur Inti atau AWS Professionals) atau yang setara
 • Menguasai kemahiran dasar dalam fitur command-line dan lingkungan sistem operasi Linux
 • Memiliki pengetahuan tentang Operasi Sistem termasuk men-deploy dan mengelola aplikasi, baik pada lingkungan lokal maupun cloud publik"
https://www.coursera.org/learn/advanced-learning-algorithms,Advanced Learning Algorithms,52349,DeepLearning.AI & Stanford University,1061,"In the second course of the Machine Learning Specialization, you will:• Build and train a neural network with TensorFlow to perform multi-class classification
• Apply best practices for machine learning development so that your models generalize to data and tasks in the real world
• Build and use decision trees and tree ensemble methods, including random forests and boosted trees

The Machine Learning Specialization is a foundational online program created in collaboration between DeepLearning.AI and Stanford Online. In this beginner-friendly program, you will learn the fundamentals of machine learning and how to use these techniques to build real-world AI applications. 

This Specialization is taught by Andrew Ng, an AI visionary who has led critical research at Stanford University and groundbreaking work at Google Brain, Baidu, and Landing.AI to advance the AI field.

This 3-course Specialization is an updated and expanded version of Andrew’s pioneering Machine Learning course, rated 4.9 out of 5 and taken by over 4.8 million learners since it launched in 2012. 

It provides a broad introduction to modern machine learning, including supervised learning (multiple linear regression, logistic regression, neural networks, and decision trees), unsupervised learning (clustering, dimensionality reduction, recommender systems), and some of the best practices used in Silicon Valley for artificial intelligence and machine learning innovation (evaluating and tuning models, taking a data-centric approach to improving performance, and more.)

By the end of this Specialization, you will have mastered key theoretical concepts and gained the practical know-how to quickly and powerfully apply machine learning to challenging real-world problems. If you’re looking to break into AI or build a career in machine learning, the new Machine Learning Specialization is the best place to start."
https://www.coursera.org/learn/unsupervised-learning-recommenders-reinforcement-learning,"Unsupervised Learning, Recommenders, Reinforcement Learning",38008,DeepLearning.AI & Stanford University,465,"In the third course of the Machine Learning Specialization, you will:• Use unsupervised learning techniques for unsupervised learning: including clustering and anomaly detection.
• Build recommender systems with a collaborative filtering approach and a content-based deep learning method.
• Build a deep reinforcement learning model.

The Machine Learning Specialization is a foundational online program created in collaboration between DeepLearning.AI and Stanford Online. In this beginner-friendly program, you will learn the fundamentals of machine learning and how to use these techniques to build real-world AI applications. 

This Specialization is taught by Andrew Ng, an AI visionary who has led critical research at Stanford University and groundbreaking work at Google Brain, Baidu, and Landing.AI to advance the AI field.

This 3-course Specialization is an updated and expanded version of Andrew’s pioneering Machine Learning course, rated 4.9 out of 5 and taken by over 4.8 million learners since it launched in 2012. 

It provides a broad introduction to modern machine learning, including supervised learning (multiple linear regression, logistic regression, neural networks, and decision trees), unsupervised learning (clustering, dimensionality reduction, recommender systems), and some of the best practices used in Silicon Valley for artificial intelligence and machine learning innovation (evaluating and tuning models, taking a data-centric approach to improving performance, and more.)

By the end of this Specialization, you will have mastered key concepts and gained the practical know-how to quickly and powerfully apply machine learning to challenging real-world problems. If you’re looking to break into AI or build a career in machine learning, the new Machine Learning Specialization is the best place to start."
https://www.coursera.org/learn/algorithms-part2,"Algorithms, Part II",266897,Princeton University,1766,"This course covers the essential information that every serious programmer needs to know about algorithms and data structures, with emphasis on applications and scientific performance analysis of Java implementations. Part I covers elementary data structures, sorting, and searching algorithms. Part II focuses on graph- and string-processing algorithms.All the features of this course are available for free.  It does not offer a certificate upon completion."
https://www.coursera.org/professional-certificates/sertifikat-it-support-profesional-google,IT Support Google,18672,Google,3130,"Bersiaplah untuk berkarier di bidang IT yang sedang tumbuh pesat, tidak diperlukan pengalaman atau gelar apa pun di sini. Dengan pelatihan profesional yang dirancang Google, bergeraklah di jalur cepat untuk mendapatkan pekerjaan dengan gaji yang kompetitif. Melalui 5 materi yang ada, Anda dapat memperoleh keterampilan yang banyak dibutuhkan dan siap bekerja di tingkat pemula. Hanya membutuhkan waktu kurang dari 10 jam per minggu, dan Anda dapat memperoleh sertifikat dalam waktu kurang dari 6 bulan. Setelah menyelesaikan program sertifikasi ini, Anda bisa mendapatkan kesempatan untuk bekerja dengan mitra konsorsium Google dari berbagai industri.

75% Lulusan Program Sertifikat Google di Amerika Serikat melaporkan adanya peningkatan karier dalam waktu 6 bulan setelah mereka memperoleh sertifikat.

Program ini juga mempersiapkan Anda untuk mengikuti ujian CompTIA A+, sertifikasi standar industri bidang IT—Anda akan mendapatkan kredensial ganda saat menyelesaikan keduanya.

Program ini disetujui ACE®—saat Anda menyelesaikannya, Anda dapat memperoleh hingga 12 kredit perguruan tinggi, setara dengan 4 materi untuk level associate.

Lihat semua program Sertifikasi Karier Google di sini. Kutipan: *berdasarkan respons survei lulusan program, Amerika Serikat 2021"
https://www.coursera.org/specializations/machine-learning-engineering-for-production-mlops,Machine Learning Engineering for Production (MLOps),40992,DeepLearning.AI,2424,"Understanding machine learning and deep learning concepts is essential, but if you’re looking to build an effective AI career, you need production engineering capabilities as well.

Effectively deploying machine learning models requires competencies more commonly found in technical fields such as software engineering and DevOps. Machine learning engineering for production combines the foundational concepts of machine learning with the functional expertise of modern software development and engineering roles.

The Machine Learning Engineering for Production (MLOps) Specialization covers how to conceptualize, build, and maintain integrated systems that continuously operate in production. In striking contrast with standard machine learning modeling, production systems need to handle relentless evolving data. Moreover, the production system must run non-stop at the minimum cost while producing the maximum performance. In this Specialization, you will learn how to use well-established tools and methodologies for doing all of this effectively and efficiently.

In this Specialization, you will become familiar with the capabilities, challenges, and consequences of machine learning engineering in production. By the end, you will be ready to employ your new production-ready skills to participate in the development of leading-edge AI technology to solve real-world problems."
https://www.coursera.org/specializations/algorithms,Algorithms,97496,Stanford University,5276,"Algorithms are the heart of computer science, and the subject has countless practical applications as well as intellectual depth. This specialization is an introduction to algorithms for learners with at least a little programming experience. The specialization is rigorous but emphasizes the big picture and conceptual understanding over low-level implementation and mathematical details. After completing this specialization, you will be well-positioned to ace your technical interviews and speak fluently about algorithms with other programmers and computer scientists.About the instructor: Tim Roughgarden has been a professor in the Computer Science Department at Stanford University since 2004. He has taught and published extensively on the subject of algorithms and their applications."
https://www.coursera.org/specializations/data-structures-algorithms,Data Structures and Algorithms,290038,University of California San Diego,12536,"Computer science legend Donald Knuth once said “I don’t understand things unless I try to program them.” We also believe that the best way to learn an algorithm is to program it. However, many excellent books and online courses on algorithms, that excel in introducing algorithmic ideas, have not yet succeeded in teaching you how to implement algorithms, the crucial computer science skill that you have to master at your next job interview. We tried to fill this gap by forming a diverse team of instructors that includes world-leading experts in theoretical and applied algorithms at UCSD (Daniel Kane, Alexander Kulikov, and Pavel Pevzner) and a former software engineer at Google (Neil Rhodes). This unique combination of skills makes this Specialization different from other excellent MOOCs on algorithms that are all developed by theoretical computer scientists. While these MOOCs focus on theory, our Specialization is a mix of algorithmic theory/practice/applications with software engineering. You will learn algorithms by implementing nearly 100 coding problems in a programming language of your choice. To the best of knowledge, no other online course in Algorithms comes close to offering you a wealth of programming challenges (and puzzles!) that you may face at your next job interview. We invested over 3000 hours into designing our challenges as an alternative to multiple choice questions that you usually find in MOOCs."
