link,title,enroll_count,provider,num_ratings,description
https://www.coursera.org/specializations/wharton-success,Achieving Personal and Professional Success,35983,University of Pennsylvania,2225,"Based on four of the most popular courses taught at the Wharton School, Achieving Personal and Professional Success is designed to introduce the tools and techniques for defining and achieving success at home and at work. You'll learn how to find your passion and core values, how to apply these values to your own life, how to work well with others, how to communicate effectively, how to set goals, how to use influence to achieve these goals, and even how to say you are sorry. Through exercises, self-diagnostic surveys, quizzes, and many case studies, you'll discover how to define not only what you want, but also the best way to get it. While many business courses cover topics related to successful organizational practices, these courses provide key insights into successful personal practices, whether you are in the office or in your home. We all bring ourselves to work every day, and these courses will help you be your best self wherever you are."
https://www.coursera.org/specializations/positivepsychology,Foundations of Positive Psychology ,53429,University of Pennsylvania,6277,"The University of Pennsylvania and Dr. Martin E.P. Seligman welcome you to Foundations of Positive Psychology. Our five-course specialization provides you with the key theories and research in the field of positive psychology as well as opportunities for application.

Course topics include

• Positive Psychology: Martin E.P. Seligman’s Visionary Science with Dr. Martin E.P. Seligman

• Positive Psychology: Applications and Interventions with Dr. James Pawelski

• Positive Psychology: Character, Grit and Research Methods with Dr. Angela Duckworth & Dr. Claire Robertson-Kraft

• Positive Psychology: Resilience Skills with Dr. Karen Reivich

• Positive Psychology Specialization Project with Dr. Martin E.P. Seligman"
https://www.coursera.org/learn/happiness,A Life of Happiness and Fulfillment,452405,Indian School of Business,5689,"What are the determinants of a happy and fulfilling life?This is surely one of life’s biggest questions, and a question that has interested many of our ancestors. Buddha famously gave up his kingdom in search of happiness. Several Greek philosophers (from Aristotle to Epicurus and Plato to Socrates) had their own views on what it takes to be happy. And of course, we all have our own theories about happiness too.

How valid are our theories?

Until recently, if you wished for an answer to this question, you would've been forced to base it on discussions with spiritual leaders. Or, if you were lucky, you could've based it on late-night (and perhaps intoxicant-fueled) conversations with friends and family. Happily, all that has changed now. Over the past decade-and-a-half, scientists have gotten into the act big time. We now have a pretty good idea of what it takes to lead a happy and fulfilling life.

This course, based on the award-winning class offered both at the Indian School of Business and at the McCombs School of Business at The University of Texas at Austin, developed by Prof. Raj Raghunathan (aka ""Dr. Happy-smarts"") draws content from a variety of fields, including psychology, neuroscience, and behavioral decision theory to offer a tested and practical recipe for leading a life of happiness and fulfillment. 

Although not mandatory, reading Prof. Raj's forthcoming book, titled If you're so smart, why aren't you happy? can help you review and assimilate the material covered in this book at your leisure. 

For Coursera learners alone, the hardcover version of the book is available for a deep discount of 50%, plus shipping and handling. You can order the hardcover for 50% off by writing to Aaron at: Aaron@800ceoread.com. Please mention that you are a student of the ""coursera happiness course"" in your email. 

The course will feature guest appearances by several well-known thought leaders, including:
      - Dan Ariely (author of Predictably Irrational and, soon to be released, Irrationally Yours),
      - Ed Diener (“Dr. Happiness”),
      - Mihaly Csikszentmihalyi (author of Flow),

By taking this course, you will discover the answers to questions such as:
      - Why aren’t the smart-and-the-successful as happy as they could—or should—be
      - What are the “7 Deadly Happiness Sins” that even the smart and the successful commit?, and
      - What are the “7 Habits of the Highly Happy” and how can you implement them in your life?

By the end of the course, I expect students who have been diligent with the lectures and exercises to not just gain a deeper understanding of the science of happiness, but to also be significantly happier."
https://www.coursera.org/learn/work-smarter-not-harder,"Work Smarter, Not Harder: Time Management for Personal & Professional Productivity",440982,"University of California, Irvine",14479,"You will be able to gain and apply your knowledge and understanding of personal and professional awareness, organization and commitment, and use the tools, methods and techniques that you have learned in goal setting, prioritization, scheduling, and delegation to overcome time management challenges and enhance productivity.Upon completing this course, you will be able to:
1.       Learn to plan effectively to achieve your personal and professional goals
2.       Learn to recognize and overcome barriers to successful time management
3.       Identify specific time management tools and use them effectively
4.       Manage resources both effectively and efficiently
5.       Keep your sense of perspective to prevent and manage crises
6.       Learn to delegate effectively
7.       Learn to manage expectations and say “No” when appropriate"
https://www.coursera.org/learn/the-science-of-well-being,The Science of Well-Being,4131687,Yale University,34710,"In this course you will engage in a series of challenges designed to increase your own happiness and build more productive habits. As preparation for these tasks, Professor Laurie Santos reveals misconceptions about happiness, annoying features of the mind that lead us to think the way we do, and the research that can help us change. You will ultimately be prepared to successfully incorporate a specific wellness activity into your life.THE SCIENCE OF WELL BEING WAS PRODUCED IN PART DUE TO THE GENEROUS FUNDING OF THE DAVID F. SWENSEN FUND FOR INNOVATION IN TEACHING."
https://www.coursera.org/learn/mindfulness,De-Mystifying Mindfulness,207029,Universiteit Leiden,1476,"Interest in meditation, mindfulness, and contemplation has grown exponentially in recent years.  Rather than being seen as mystical practices from ancient Buddhism or esoteric philosophy, they are increasingly seen as technologies rooted in evidence from psychology and neuroscience.  Mindfulness has become the basis for numerous therapeutic interventions, both as a treatment in healthcare and as a means of enhancing well-being and happiness.  For millions around the world, mindfulness has become a life-style choice, enhancing and enriching everyday experience. Mindfulness is big business.But, what actually is mindfulness?  Is it really good for you?  Can anyone learn it?  How can you recognize charlatans? Would you want to live in a mindful society, and would it smell like sandalwood?  What does it feel like to be mindful?  Are you mindful already, and how would you know?

Evolving from the popular Honours Academy course at Leiden University, this innovative course combines conventional scholarly inquiry from multiple disciplines (ranging from psychology, through philosophy, to politics) with experiential learning (including specially designed ‘meditation labs,’ in which you’ll get chance to practice and analyze mindfulness on yourself).  In the end, the course aims to provide a responsible, comprehensive, and inclusive education about (and in) mindfulness as a contemporary phenomenon.

During the production of this course, we have been supported by Willem Kuyken, Director of the University of Oxford Mindfulness Centre, and Stephen Batchelor, co-founder of Bodhi College.  And we gratefully acknowledge the contributions made by Mark Williams, co-developer of Mindfulness-based Cognitive Therapy (MBCT), and Rebecca Crane, Director of the Centre for Mindfulness Research and Practice at the University of Bangor. We have recently added expert advice from Dawn Scott (Spirit Rock & Barre Centre for Buddhist Studies), Sydney Spears (University of Kansa), Elisabeth Stanley (Georgetown University), Susan Woods (Centre for Mindfulness Studies), Patricia Rockman (University of Toronto) and Jeff Corntassel (University of Victoria).

""A deep and profound dive into the ethical, social, psychological, and philosophical implications of modern-day mindfulness practice. The course is not for the faint of heart, perhaps, but it is also full of practical, guided exercises for the uninitiated! Thank you for redefining my relationship to Mindfulness in a completely new and thought-provoking way"" 28 april 2021

""The course enabled me to explore the mindfulness construct at its deeper lever from philosophical, psychological and political lenses. The mindfulness labs were very useful in practicing the skills of being mindful."" 23 nov 2018

""i took this course after a period of time when I was trying to practice mindfulness and meditation, but with doubtful success. The course answered many questions to me, and I needed that to keep me motivated. It really helped me understand the origins and, more importantly, benefits of mindfulness practice and made me persist in my attempts. I'm really glad I took the course, I find it interesting, well taught and very useful for all those seeking deeper explanation in why trying mindfulness."" 9 Oct 2018

""I have taken other courses in other online platforms. However, this has been one of the best courses I have found online."" 3 Oct 2018

""I really like the invitation to us, the learners, to rethink our preconceptions and beliefs, and then make our own judgement about mindfulness. The overall tone was very friendly and open, resources very useful."" 12 Dec 2017"
https://www.coursera.org/learn/positive-psychology,Positive Psychology ,281070,The University of North Carolina at Chapel Hill,5685,"This course discusses research findings in the field of positive psychology, conducted by Barbara Fredrickson and her colleagues. It also features practical applications of this science that you can put to use immediately to help you live a full and meaningful life."
https://www.coursera.org/learn/mindshift,Mindshift: Break Through Obstacles to Learning and Discover Your Hidden Potential,411037,McMaster University,12103,"Mindshift is designed to help boost your career and life in today’s fast-paced learning environment. Whatever your age or stage, Mindshift teaches you essentials such as how to get the most out of online learning and MOOCs, how to seek out and work with mentors, the secrets to avoiding career ruts (and catastrophes) and general ruts in life, and insights such as the value of selective ignorance over general competence.  We’ll provide practical insights from science about how to learn and change effectively even in maturity, and we’ll build on what you already know to take your life’s learning in fantastic new directions.  This course is designed to show you how to look at what you’re learning, and your place in what’s unfolding in the society around you, so you can be what you want to be, given the real world constraints that life puts on us all. You’ll see that by using certain mental tools and insights, you can learn and do more—far more—than you might have ever dreamed!This course can be taken independent of, concurrent with, or subsequent to, its companion course, Learning How to Learn.  (Mindshift is more career focused, and Learning How to Learn is more learning focused.)"
https://www.coursera.org/learn/communicate-with-impact,Storytelling and influencing: Communicate with impact,60508,Macquarie University,1454,"An ambitious vision for the future of your organisation isn’t enough – how do you communicate this vision to get your colleagues on board? The ability to effectively communicate and persuade others is a key leadership skill. Traditional and common-sense models of communication and persuasion often fail to capture the complex nature of ‘influencing’. Via structured learning activities (video lectures, quizzes, discussion prompts and written assessments) this course will develop your capacity to communicate appropriately in different situational and cultural contexts, making you a highly influential leader."
https://www.coursera.org/specializations/good-with-words-speaking-and-presenting,Good with Words: Speaking and Presenting,4958,University of Michigan,76,"Suppose you were good with words. Suppose when you decided to speak, the message you delivered—and the way you delivered it—successfully connected with your intended audience. What would that mean for your career prospects? What would that mean for your comfort level in social situations? And perhaps most importantly, what would that mean for your satisfaction with the personal relationships you value the most? This specialization is designed to help you find out. Based on an award-winning course and workshop series at the University of Michigan that has been taken by students training to enter a wide range of fields—law, business, medicine, social work, public policy, design, engineering, and many more—it removes the guesswork from figuring out how to communicate clearly and compellingly.All of us have ideas that are worth sharing. Why not learn to convey yours in a way that people will appreciate, enjoy, and remember?"
https://www.coursera.org/learn/negotiation,Introduction to Negotiation: A Strategic Playbook for Becoming a Principled and Persuasive Negotiator,464385,Yale University,4430,"This course will help you be a better negotiator. Unlike many negotiation courses, we develop a framework for analyzing and shaping negotiations. This framework will allow you to make principled arguments that persuade others. It will allow you to see beneath the surface of apparent conflicts to uncover the underlying interests. You will leave the course better able to predict, interpret, and shape the behavior of those you face in competitive situations.In this course, you will have several opportunities to negotiate with other students using case studies based on common situations in business and in life. You can get feedback on your performance and compare what you did to how others approached the same scenario. The cases also provide a setting to discuss a wide-ranging set of topics including preparing for a negotiation, making ultimatums, avoiding regret, expanding the pie, and dealing with someone who has a very different perspective on the world. Advanced topics include negotiating when you have no power, negotiating over email, and the role of gender differences in negotiation. To close out the course, we will hear insights from three negotiation experts: Linda Babcock, Herb Cohen, and John McCall MacBain. Enjoy."
https://www.coursera.org/specializations/improve-english,Improve Your English Communication Skills,548124,Georgia Institute of Technology,14881,"This Specialization helps you improve your professional communication in English for successful business interactions. Each course focuses on a particular area of communication in English: writing emails, speaking at meetings and interviews, giving presentations, and networking online. Whether you want to communicate to potential employers, employees, partners or clients, better English communication can help you achieve your language and professional goals. The Capstone course will focus especially on making those important connections to take your career or business to the next level. Make yourself more competitive by improving your English through this Specialization: Improve Your English Communication Skills."
https://www.coursera.org/learn/communication-strategies-virtual-age,Communication Strategies for a Virtual Age,169762,University of Toronto,4067,"Communication has changed! The traditional rules for speaking and presenting, meeting coordination, influencing people, negotiating and selling ideas no longer apply in a world of skype, messenger, video and teleconference.  This course will act as an overview on several concepts each of which could be a course of their own and our goal is to give you tools that you can practice and perfect on your own.By the end of this course, you will be able to:

•	Apply communication principles and techniques for in-person and virtual teams
•       Use a science based approach to create impactful presentations
•	Refine your communication style to better persuade and influence others
•	Run more effective and impactful meetings
•       Incorporate strategies to have positive difficult conversations and make people feel valued and listened to

*** This course will require you to record yourself speaking.  Therefore you must have a phone/computer with a functional camera and microphone.***

WHO SHOULD TAKE THIS COURSE?
Anyone looking for professional and/or leadership development.  This class mainly uses examples from the professional, business environment.  If you are looking to advance at your current organization or to enhancing your personal value for potential employers this course is for you.

WHAT MAKES THIS COURSE EFFECTIVE?
Many educational experiences describe and explain, but in this course we will apply and demonstrate.  We teach practical and proven concepts, show you how to apply them and give you opportunities to practice them in a safe and supportive environment. This course is full of opportunities to put the ideas presented into practice and test their effectiveness for yourself.

WHY SHOULD YOU TAKE THIS COURSE?
We will challenge the preconceived ideas about what it means to be part of a virtual team, and support you to be a dynamic team contributor no matter where you work. In this course you can expect to be both energized and uncomfortable – like in most experiences that result in positive growth and change!

This course is offered through the University of Toronto School of Continuing Studies (https://learn.utoronto.ca/)."
https://www.coursera.org/learn/brand-and-content-marketing, Storytelling in Branding and Content Marketing ,21996,IE Business School,228,"Storytelling in Branding and Content Marketing is an IE University course for professionals who want to learn how to produce memorable content through quality storytelling.Students will go through a learning process that will start with a deep understanding of the term Branded Content and its main differences with traditional advertising, simultaneously creating an effective storyline based on strong brand values and messages. The course analyses the production of quality journalism and explores how to create memorable and long-lasting connections with a given target audience in a world of constant content surplus. It concludes with a deeper insight into the term of Brand Entertainment, giving them the opportunity to amplify their knowledge about how to produce a good call to action and retain the audience's attention."
https://www.coursera.org/learn/emotional-and-social-intelligence,Emotional and Social Intelligence,25397,"University of California, Davis",731,"""We are wired to connect. Neuroscience has discovered that our brains very design makes it sociable, inexorably drawn into an intimate brain to brain linkup whenever we engage with another person.""  Daniel Goleman – Prologue – Social IntelligenceEmotional and Social Intelligence (ESI) is defined as a set of competencies demonstrating the ability one has to recognize their behaviors, moods, and impulses, and to manage them best according to the situation. This course will give you the tools you need to be emotionally and socially intelligent in your workplace.
 
Having the ability to master ESI gives employees a distinct advantage in their positions. It allows them to access their emotional center while managing their relationships with their team members. Competencies associated with emotional and social intelligence are often what separates an average performer from a great one. And, unlike our overall intelligence, emotional intelligence can be learned and improved over time. 

In this course, we will explain the value of emotional and social intelligence for professional success. We'll assess current emotional and social intelligence skills and you will discover the Foundational 4 Quadrants of Emotional and Social Intelligence (ESI) to understand, use and manage emotions. We will explain how stress can impact application of emotional and social intelligence skills, and reflect upon needed actions to take to create connections and build relationships for greater professional effectiveness."
https://www.coursera.org/specializations/project-management-success,Project Management & Other Tools for Career Development,82344,"University of California, Irvine",5812,"Project management has been proven to be the most effective method of delivering products within cost, schedule, and resource constraints. It is an essential skill in the modern digital constantly changing world.

This intensive and hands-on series of courses gives you a blend of skills from project management. Successful projects require careful upfront planning. In this specialization, you will gain a strong working knowledge of the basics of project management. You’ll learn the key roles and responsibilities of the project manager and project team and to answer some key questions upfront to help you meet project objectives, as well as managing project risk.

Additionally, this specialization will train you in essential career success skills that have become indispensable, like business writing, negotiation and effective problem-solving. Thus, in addition to introducing you to project management, this specialization will help you build, develop and hone the essential skills needed to improve your employability and advancement in today’s dynamic workforce, giving you a complete, comprehensive skill set."
https://www.coursera.org/specializations/good-with-words,Good with Words: Writing and Editing,47094,University of Michigan,1573,"Perhaps the most important thing students and professionals of all kinds can do to improve their effectiveness is embrace the following advice: become good with words.This series of courses targets the writing side of that recommendation. The skills it focuses on include everything from how to arrange a complex set of information in a reader-friendly way, to how to give and receive high-quality feedback, to how to consistently hit deadlines.

Part of Professor Barry’s proceeds from this course will be donated to the COVID-19 relief efforts of Ozone House, a shelter for homeless youth in Southeastern Michigan where he regularly conducts job-training workshops. These proceeds come from purchases of the version of the course that earns you a certificate. The course remains free for anyone who is simply auditing."
https://www.coursera.org/specializations/professional-skills-for-the-workplace,Professional Skills for the Workplace,9687,"University of California, Davis",486,"This Specialization is intended for working professionals early in their career and for organizations who look to improve interpersonal relationship skills among their employees, clients, and customers.

Through four courses, you will explore the use of emotional and social intelligence, practice a formula for problem solving, cultivate a growth mindset, and build skills related to adaptability and resilience in an ever-changing environment. These skills show up in business relationships and communication and ultimately impact professional effectiveness. You will be able to demonstrate sound judgment by engaging in critical thinking to reach decisions and solve problems independently. You will be able to develop a competitive advantage by learning, adapting, and harnessing insights from past endeavors. You will assess your own expectations in your current or anticipated work roles and settings, and how those may align with or differ from what is required by employers and other stakeholders now and in the future."
https://www.coursera.org/learn/business-writing,High-Impact Business Writing,179072,"University of California, Irvine",3556,"Effective writing is a powerful tool in the business environment. Learn how to articulate your thoughts in a clear and concise manner that will allow your ideas to be better understood by your readers. Improve your business writing skill by learning to select and use appropriate formats for your audience, use the correct medium and adjust your writing style accordingly, as well as identify your objective and communicate it clearly. You'll also learn to spot, correct and avoid the most common writing pitfalls, and gain valuable experience analyzing, writing and revising a wide spectrum of business documents. From a simple email to a complete report, learn how to put good business writing to work for you.Upon completing this course, you will be able to:
1.       Write effective business communications, including bad news, good news, persuasive writing, presentations, emails, memos, business reports and press releases
2.       Learn how to edit and proofread business documents
3.       Learn how to write for a global market"
