link,title,enroll_count,provider,num_ratings,description
https://www.coursera.org/learn/liderazgo,Liderazgo para el Siglo XXI: proyecto final,6273,Universidad de los Andes,273,"Este curso está diseñado para acompañarte en seleccionar un desafío personal de liderazgo y aplicar herramientas con las cuales realizarás experimentos y evaluarás el ciclo de diagnóstico y acción en tu tema. Asimismo, serás consiente de cómo en el proceso, el fracaso y la resiliencia te ayudarán a avanzar en tus restos de liderazgo. Al finalizar este curso estarás en capacidad de:1.	Utilizar herramientas de diagnóstico y acción para avanzar en un proyecto de liderazgo propio.
2.	Practicar y profundizar el uso de narrativas y otras herramientas de comunicación (con uno mismo y con otros) para fortalecer el ejercicio personal de liderazgo.
3.	Desarrollar resiliencia, una habilidad que permite perseverar en proyectos de liderazgo.

El Programa especializado en “Liderazgo Efectivo para el Siglo XXI”, es el primer programa especializado en línea, abierto y masivo que se produce desde el Centro de Liderazgo Público (CLP) de la Escuela de Gobierno Alberto Lleras Camargo de la Universidad de los Andes, Colombia. El CLP tiene como misión crear conocimiento y capacidad de liderazgo para ayudar a que progresemos en los temas complejos que más nos importan en el mundo actual. 

El programa fue diseñado por Maite Careaga Tagüeña, PhD y Héctor Fabio Hernández, MPP, con el apoyo de Saluma Castillo y el equipo Conecta-TE de la Universidad de los Andes, Colombia, y está inspirado en los cursos y talleres  de liderazgo que Maite lleva 15 años diseñando y facilitando  (los primeros los diseñó junto con Felipe Bozzo y Sebastián Quirmbach en Leaderbuilding) y en las lecciones aprendidas  al investigar cómo diseñar y evaluar estrategias pedagógicas para enseñar habilidades personales y sociales para el liderazgo.

Este curso ha sido diseñado como el cuarto y último del programa especializado (https://www.coursera.org/specializations/liderazgo), el cual te permitirá adueñarte de una metodología de intervención, que llamamos espiral de liderazgo consciente, y desarrollar y aplicar una caja de herramientas para movilizar personas (a sí mismo y a otros) a trabajar en solucionar los desafíos complejos que las afectan e importan. Los otros tres cursos del programa son: ""Estilos de Liderazgo: opciones para avanzar en desafíos complejos"", ""Autoliderazgo y Gestión de Emociones para Avanzar en Desafíos Complejos"" y ""Comunicación, Experimentación y Aprendizaje en Liderazgo"". Puedes tomar todos los cursos por separado o sólo uno de ellos, sin embargo te recomendamos que te inscribas y participes en los cuatro, ojalá en el orden que te proponemos."
https://www.coursera.org/learn/aprender,Aprendendo a aprender: ferramentas mentais poderosas para ajudá-lo a dominar assuntos difíceis (em Português) [Learning How to Learn],190365,Deep Teaching Solutions,3681,"Este curso dá-lhe acesso fácil a técnicas de aprendizagem de valor inestimável, usadas por especialistas em Arte, Música, Literatura, Matemática, Ciência, Esportes e muitas outras disciplinas. Vamos aprender sobre a forma como o cérebro usa dois modos de aprendizagem muito diferentes e como ele encapsula (em ""pedaços"") informações. Também vamos falar sobre ilusões de aprendizagem, técnicas de memória, lidar com a procrastinação, e as melhores práticas apresentadas pela investigação a ser mais eficaz em o ajudar a dominar assuntos difíceis.

Usando essas abordagens, não importa os seus níveis de habilidade em tópicos que você gostaria de dominar, você pode mudar o seu pensamento e mudar sua vida. 
Se você já é um especialista, essa ""espiada embaixo do capô"" lhe dará ideias para turbinar sua aprendizagem de forma bem sucedida, incluindo dicas contra intuitivas para realização de testes, que lhe ajudarão a fazer o melhor uso do seu tempo em deveres de casa e situações de problemas. Se estiver com dificuldades, você verá um tesouro estruturado de técnicas práticas que lhe mostrarão o que precisa fazer para entrar nos trilhos. Se você já quis melhorar em qualquer coisa, este curso vai servir como um guia.

This is a translated version. To join the original English version, visit this page: https://www.coursera.org/learn/learning-how-to-learn

Este curso está disponível também em Espanhol. Para entrar na versão completamente traduzida, visite esta página:  https://www.coursera.org/learn/aprendiendo-a-aprender⏎

Este curso está disponível também em Chinês. Para entrar na versão completamente traduzida, visite esta página: https://www.coursera.org/learn/ruhe-xuexi"
https://www.coursera.org/learn/ensino-hibrido,Ensino Híbrido: Personalização e Tecnologia na Educação,24086,Fundação Lemann & Instituto Península ,618,"Neste curso, oferecido pela Fundação Lemann em parceria com o Instituto Península, você terá a oportunidade de aprender, a partir de experiências reais, como integrar as tecnologias digitais no seu contexto escolar. As vivências compartilhadas pelos diferentes professores envolvidos neste curso lhe proporcionará reflexões sobre os modelos de Ensino Híbrido e sua relação com a personalização do ensino.A expectativa é apresentar a você possibilidades de integração das tecnologias digitais ao currículo escolar, de forma a alcançar uma série de benefícios no dia a dia da sala de aula, entre elas:

Aproximação da realidade escolar com o cotidiano do aluno;
Maior engajamento dos alunos no aprendizado;
Melhor aproveitamento do tempo do professor;
Ampliação do potencial do professor para intervenções efetivas;
Planejamento personalizado.

A carga horária prevista para a conclusão do curso é de 40h.

Vamos lá? Comece agora mesmo!"
https://www.coursera.org/professional-certificates/arizona-state-university-tesol,Arizona State University TESOL,43097,Arizona State University,4667,"This course is designed for anyone who wants to teach English anywhere in the world. If you want to become a teacher, polish your teaching skills, or add a credential to your resume, this is the course for you! Get certified by a nationally-ranked university."
https://www.coursera.org/learn/sciwrite,Writing in the Sciences,369940,Stanford University,7156,"This course teaches scientists to become more effective writers, using practical examples and exercises. Topics include: principles of good writing, tricks for writing faster and with less anxiety, the format of a scientific manuscript, peer review, grant writing, ethical issues in scientific publication, and writing for general audiences."
https://www.coursera.org/learn/aprendiendo-a-aprender,Aprendiendo a aprender: Poderosas herramientas mentales con las que podrás dominar temas difíciles (Learning How to Learn),339385,Deep Teaching Solutions,9924,"Este curso te brinda acceso a invaluables técnicas de aprendizaje utilizadas por expertos en arte, música, literatura, matemáticas, ciencia, deportes y muchas otras disciplinas. Aprenderemos cómo el cerebro utiliza dos modos de aprendizaje muy distintos y cómo encapsula (“fragmenta”) la información. También hablaremos sobre ilusiones de aprendizaje, técnicas de memoria, cómo ocuparse de la procrastinación y las mejores prácticas, según lo demuestra la investigación, para ayudarte a dominar los temas más complicados.Con estos enfoques, más allá de tus niveles de destreza en los temas que quieras dominar, puedes cambiar tu pensamiento y tu vida. Si ya eres un experto, este vistazo de la maquinaria cerebral te dará ideas para disparar un nuevo aprendizaje poderoso, con consejos contraintuitivos para presentar exámenes y perspectivas que te ayudarán a aprovechar al máximo el tiempo que dedicas a las tareas y a la resolución de problemas. Si estás teniendo dificultades, descubrirás un cofre del tesoro estructurado con técnicas prácticas que te orientan acerca de lo que debes hacer para mejorar. Si alguna vez deseaste ser mejor en algún ámbito del aprendizaje, este curso te servirá como guía.

Este curso también está disponible otros idiomas:
Para unirte a la versión en inglés, visita: https://www.coursera.org/learn/learning-how-to-learn
Para unirte a la versión en portugués, visita: https://www.coursera.org/learn/aprender
Para unirte a la versión en chino, visita: https://www.coursera.org/learn/ruhe-xuexi"
https://www.coursera.org/learn/positive-psychology-resilience,Positive Psychology: Resilience Skills,64922,University of Pennsylvania,1887,"Learn how to incorporate resilience interventions into your personal and professional life with Dr. Karen Reivich. In this course, you are exposed to the foundational research in resilience, including protective factors such as mental agility and optimism. Several types of resilience interventions are explored including cognitive strategies; strategies to manage anxiety and increase positive emotions such as gratitude; and a critical relationship enhancement skill. Throughout the course, you will hear examples of individuals using resilience skills in their personal and professional lives.  Suggested prerequisites: Positive Psychology: Martin E. P. Seligman’s Visionary Science, Positive Psychology: Applications and Interventions and Positive Psychology: Character, Grit & Research Methods."
